source,title,url
Montsame,“Эсгийн гайхамшиг-Шинэ дуу хоолой” эсгий урлалын өнөөгийн өнгө төрх,https://montsame.mn/mn/read/396691
Montsame,Ц.Магсар: Цаг хугацаа өнгөрөх тусам Д.Нацагдорж тодорно хэмээн үнэлсэн байдаг,https://montsame.mn/mn/read/396554
Montsame,Үлэг гүрвэлийн олдворуудыг эх оронд нь эргүүлэн авчрах ажлын хэсэг Парис хотноо ажиллав,https://montsame.mn/mn/read/396683
Montsame,"ИТХ-ын сонгуулийн тухай хуульд өөрчлөлт оруулах тухай хуулийн төслийг өргөн мэдүүлэв Улаанбаатар, 2026 оны дөрөвдүгээр сарын 21 /МОНЦАМЭ/. УИХ-ын дарга С.Бямбацогтод... 1 цаг",https://montsame.mn/mn/read/396716
Montsame,"Монгол Улсын хэмжээнд тарьц суулгацын нөөц 163 сая хүрчээ Улаанбаатар, 2026 оны дөрөвдүгээр сарын 21 /МОНЦАМЭ/. Монгол Улсын Ерөнхийлөгч... 3 цаг",https://montsame.mn/mn/read/396697
Montsame,"НҮБ-ын конвенцын Талуудын 17 дугаар бага хурлын албан ёсны цахим хуудсыг нээв Улаанбаатар, 2026 оны дөрөвдүгээр сарын 21 /МОНЦАМЭ/. Монгол Улсад зохион байгуулах... 3 цаг",https://montsame.mn/mn/read/396699
Montsame,"“Дүнжингарав-2026” хаврын морин уралдааны тов гарлаа Улаанбаатар, 2026 оны дөрөвдүгээр сарын 21 /МОНЦАМЭ/. Монголын Морин Спорт, Уяачдын... 4 цаг",https://montsame.mn/mn/read/396689
Montsame,"“Мастер, Маргарита хоёр” романаас сэдэвлэсэн жүжгийн найруулагчаар Э.Билгүүн ажиллана Улаанбаатар, 2026 оны дөрөвдүгээр сарын 21 /МОНЦАМЭ/. Улсын Драмын Эрдмийн Театрын уран... 4 цаг",https://montsame.mn/mn/read/396671
Montsame,"Гавьяат тамирчин Б.Сэр-Од Бостоны марафонд 54 дүгээрт бариалжээ Улаанбаатар, 2062 оны дөрөвдүгээр сарын 21 /МОНЦАМЭ/. Монгол Улсын гавьяат тамирчин,... 4 цаг",https://montsame.mn/mn/read/396674
Montsame,"Сербид олгох 1.5 тэрбумын санхүүжилтийг зогсооно гэж анхааруулав БРЮССЕЛЬ, 2026 оны дөрөвдүгээр сарын 21 /DW/. Хэрвээ ардчиллын эсрэг чиг хандлагаа... 1 цаг",https://montsame.mn/mn/read/396717
Montsame,"Японы зэвсгийн экспортод тавьсан хязгаарлалтыг цуцалжээ ТОКИО, 2026 оны дөрөвдүгээр сарын 21 /TASS/. Японы Засгийн газар “батлан хамгаалахын... 2 цаг",https://montsame.mn/mn/read/396701
Montsame,"Филиппин-Америкийн хамтарсан сургуулилалтад Япон улс анх удаа оролцож байна МАНИЛА, 2026 оны дөрөвдүгээр сарын 21 /Kyodo/. Филиппин, АНУ-ын Зэвсэгт хүчний жил тутмын... 3 цаг",https://montsame.mn/mn/read/396688
Montsame,"Шинэ чиглэлийг эрэлхийлэх нь: Казахстан Улс Монголын стратегийн чухал чиглэл болж байна БАКУ, 2026 оны дөрөвдүгээр сарын 21 /Trend/. Бүгд Найрамдах Казахстан Улсын Ерөнхийлөгч... 4 цаг",https://montsame.mn/mn/read/396673
Montsame,"""Бавариа"" баг дөрвөн тоглолтын өмнө Германы аварга боллоо БЕРЛИН, 2026 оны дөрөвдүгээр сарын 21 /ТАСС/. “Бавариа” баг ням гарагт “Штутгарт”-ыг 4:2... 4 цаг",https://montsame.mn/mn/read/396682
Montsame,"Энэтхэг-Өмнөд Солонгосын худалдааг 50 тэрбум ам.долларт хүргэнэ ШИНЭ ДЕЛИ, 2026 оны дөрөвдүгээр сарын 21 /Reuters/. Энэтхэг, БНСУ-ын эрх баригчид 2030 он... 5 цаг",https://montsame.mn/mn/read/396661
Montsame,"Т.Санаэ Ясүкүни сүмд өргөл барьц илгээжээ ТОКИО, 2026 оны дөрөвдүгээр сарын 21 /Kyodo/. Японы Ерөнхий сайд Такаичи Санаэ гурван... 5 цаг",https://montsame.mn/mn/read/396645
Montsame,"Д.Трамп: Израил улс намайг Ирантай дайтахыг ятгаагүй ВАШИНГТОН, 2026 оны дөрөвдүгээр сарын 21 /Reuters/. Иранд цохилт өгөх шийдвэр гаргахад... 5 цаг",https://montsame.mn/mn/read/396656
Montsame,"АНУ-тай хэлэлцээ хийхгүй гэж мэдэгджээ ТЕХРАН, 2026 оны дөрөвдүгээр сарын 21 /Irna/. Иран улс заналхийлэл, шахалт дор АНУ-тай... 5 цаг",https://montsame.mn/mn/read/396658
Montsame,Өвөрхангай аймагт орчин үеийн жишиг эмнэлгүүд ашиглалтад оржээ 16 минут,https://montsame.mn/mn/read/396727
Montsame,"ЗАВХАН: Монгол бичиг, уран бичлэгийн уралдаануудад Сантмаргаз сумын хүүхдүүд хошуучлав Улиастай. 2026 оны дөрөвдүгээр сарын 21. /МОНЦАМЭ/. Үндэсний бичиг үсгийн баярын хүрээнд... 1 цаг",https://montsame.mn/mn/read/396718
Montsame,"ХОВД: Нутгийн 50 орчим хувьд бэлчээрийн ургамал цухуйжээ Жаргалант, 2026 оны дөрөвдүгээр сарын 21 /МОНЦАМЭ/. Ховд аймгийн хэмжээнд бэлчээрийн... 1 цаг",https://montsame.mn/mn/read/396715
Montsame,ЗАВХАН: Хөгжлийн бэрхшээлтэй иргэдийн хөгжлийн төвийн барилгын ажил эхэллээ Улиастай. 2026 оны дөрөвдүгээр сарын 21. /МОНЦАМЭ/. Завхан аймагт Азийн хөгжлийн банкны... 2 цаг,https://montsame.mn/mn/read/396714
Montsame,"Төвийн бүсийн “Чадварлаг сувилагч” тэмцээнд Орхон аймгийн сувилагчид тэргүүллээ Баян-Өндөр, 2026 оны дөрөвдүгээр сарын 21 /МОНЦАМЭ/. “Чадварлаг сувилагч” төвийн бүсийн... 2 цаг",https://montsame.mn/mn/read/396569
Montsame,"БАЯНХОНГОР: Усан хөтлийн уяад 200 бог багтдаг Баянхонгор, 2026 оны дөрөвдүгээр сарын 21 /МОНЦАМЭ. Баянхонгор аймгийн Баян-Овоо сумын... 3 цаг",https://montsame.mn/mn/read/396702
Montsame,Өвөрхангай аймгийг авто замын сүлжээнд холбоно 3 цаг,https://montsame.mn/mn/read/396704
Montsame,"СЭЛЭНГЭ: Гадаадын хөрөнгө оруулалтыг нэмэгдүүлэх алхмууд хийж байна Сүхбаатар, 2026 оны дөрөвдүгээр сарын 21 /МОНЦАМЭ/. Сэлэнгэ аймгийн Алтанбулагийн чөлөөт... 3 цаг",https://montsame.mn/mn/read/396698
Montsame,"ӨМНӨГОВЬ: Орон нутгийн төсвийн 23 хувийг боловсрол, авто замын салбарт 16 хувийг зарцуулж байна 3 цаг",https://montsame.mn/mn/read/396694
Montsame,"Монголын үнэт цаасны зах зээлийн нийт гүйлгээ 2026 оны эхний улиралд 269.5 тэрбум төгрөгт хүрчээ Улаанбаатар, 2026 оны дөрөвдүгээр сарын 20 /МОНЦАМЭ/. 2026 оны эхний улирлын байдлаар... 1 өдөр",https://montsame.mn/mn/read/396556
Montsame,"Ормузийн хоолой дэлхийн зах зээлийн анхаарлын төвд дахин орж ирэв Улаанбаатар, 2026 оны дөрөвдүгээр сарын 20 /МОНЦАМЭ/. Өнгөрсөн долоо хоногт Ойрх Дорнодын... 1 өдөр",https://montsame.mn/mn/read/396560
Montsame,"ТОП-50-д багтсан Казахстаны тухай сонирхолтой баримтууд УЛААНБААТАР, 2026 оны дөрөвдүгээр сарын 20 /МОНЦАМЭ/. Энэ өдрүүдэд Монгол Улсын... 1 өдөр",https://montsame.mn/mn/read/396438
Montsame,"АРВАНЗУРГАА ДАХЬ ДОЛОО ХОНОГ: АНУ, Ираны төлөөлөгчид хэлэлцээ хийлээ УЛААНБААТАР, 2026 оны дөрөвдүгээр сарын 18 /МОНЦАМЭ/. Ойрх Дорнодод сар гаруйн өмнө... 3 өдөр",https://montsame.mn/mn/read/396416
Montsame,"Орбан ялагдсан ч “орбанизм” ялагдаагүй БУДАПЕШТ, 2026 оны дөрөвдүгээр сарын 17 /ВВС/. Сүүлийн 16 жилийн хугацаанд Виктор Орбан... 4 өдөр",https://montsame.mn/mn/read/396410
Montsame,"Хөрөнгө оруулалт бонд, технологи, хиймэл оюунтай холбоотой хувьцаанууд руу дахин чиглэжээ Улаанбаатар, 2026 оны дөрөвдүгээр сарын 13 /МОНЦАМЭ/. Ойрх Дорнод дахь зэвсэгт мөргөлдөөн... 8 өдөр",https://montsame.mn/mn/read/395885
Montsame,"Монгол Улсад эрдэс баялгийн салбар эдийн засгийн гол тулгуур хэвээр байна Улаанбаатар, 2026 оны дөрөвдүгээр сарын 13 /МОНЦАМЭ/. Монгол Улсын хувьд эрдэс баялгийн... 8 өдөр",https://montsame.mn/mn/read/395877
Montsame,"Түүхэн нислэгийн тэгш ойд зориулсан сонирхолтой баримтууд УЛААНБААТАР, 2026 оны дөрөвдүгээр сарын 12 /МОНЦАМЭ/. Одоогоос яг 65 жилийн өмнө ЗХУ-ын... 9 өдөр",https://montsame.mn/mn/read/395790
Montsame,"АРВАНТАВ ДАХЬ ДОЛОО ХОНОГ: Ойрх Дорнодын дайн түр зогслоо УЛААНБААТАР, 2026 оны дөрөвдүгээр сарын 11 /МОНЦАМЭ/. Өнгөрч буй долоо хоног хүн... 10 өдөр",https://montsame.mn/mn/read/395785
Montsame,"Сургуулиа төгсөөд дээд сургуульд ороогүйдээ нэг их харамсдаггүй Баруун-Урт, 2026 оны дөрөвдүгээр сарын 21 /МОНЦАМЭ/. Намайг С.Мөнх-Эрдэнэ гэдэг. Хувиараа... 6 цаг",https://montsame.mn/mn/read/389712
Montsame,"61 настай оюун ухааны тамирчин Улаанбаатар, 2026 оны дөрөвдүгээр сарын 21 /МОНЦАМЭ/. Намайг Даваа овогтой Гандолгор... 6 цаг",https://montsame.mn/mn/read/396142
Montsame,"Боксын хүч, иогийн зөөлөн хэмнэл зүрх сэтгэлийг минь тэнцвэртэй болгодог Улаанбаатар, 2026 оны дөрөвдүгээр сарын 17 /МОНЦАМЭ/. Гурван ахтай, айлын ганц охин... 4 өдөр",https://montsame.mn/mn/read/390208
Montsame,"Хилийн чанадад сурч, эх орондоо ирэх сонголтыг хийсэн маань оносон Улаанбаатар, 2026 оны дөрөвдүгээр сарын 17 /МОНЦАМЭ/. Намайг Хүрэлчулуун овогтой... 4 өдөр",https://montsame.mn/mn/read/396001
Montsame,"Хэрэв би ном уншдаггүй байсан бол ийм итгэлтэй байж чадахгүй Эрдэнэбулган, 2026 оны дөрөвдүгээр сарын 14 /МОНЦАМЭ/. Зарим хүүхэд багаасаа л номтой... 7 өдөр",https://montsame.mn/mn/read/394963
Montsame,"Гагнуураар амьдралаа бүтээж, зургаар мөрөөдлөө биелүүлнэ Улаанбаатар, 2026 оны дөрөвдүгээр сарын 14 /МОНЦАМЭ/. Намайг Эрдэнэ овогтой Уужимсэтгэлт... 7 өдөр",https://montsame.mn/mn/read/395750
Montsame,"Морин дээрээс 7 секундэд 10 сум харвах мэдрэмж Улаанбаатар, 2026 оны дөрөвдүгээр сарын 10 /МОНЦАМЭ/. Монголын морьт харваачид хамгийн... 11 өдөр",https://montsame.mn/mn/read/390550
Montsame,"160 тонн хүдэр тээвэрлэгчийн жолооч монгол охин Улаанбаатар, 2026 оны дөрөвдүгээр сарын 10 /МОНЦАМЭ/. Намайг Ганбаатар овогтой Сугарсүрэн... 11 өдөр",https://montsame.mn/mn/read/395657
Montsame,"Номын амт ба ном уншдаг, уншдаггүй хүний ялгаа Эрдэнэбулган, 2026 оны дөрөвдүгээр сарын 7 /МОНЦАМЭ/. Би энэ хичээлийн жил эхэлснээс хойш... 14 өдөр",https://montsame.mn/mn/read/394941
Montsame,ОРХОН: Масс олимпиадад 3 дугаар ангийн сурагчдыг анх удаа хамрууллаа 3 өдөр,https://montsame.mn/mn/read/396467
Montsame,ОРХОН: “Аврагч-2026” тэмцээнийг 27 дахь жилдээ зохион байгуулж байна 4 өдөр,https://montsame.mn/mn/read/396382
Montsame,ДАРХАН-УУЛ: Морин хуурын дугуйлангуудад дэмжлэг үзүүллээ 4 өдөр,https://montsame.mn/mn/read/396308
Montsame,ДОРНОГОВЬ: Хар загийн байгалийн үзэсгэлэнт газар 5 өдөр,https://montsame.mn/mn/read/396298
Montsame,СЭЛЭНГЭ: Багачууд инженерийн мэдлэгээ сорилоо 5 өдөр,https://montsame.mn/mn/read/396266
Montsame,ДОРНОД: Гавьяат дасгалжуулагч Ё.Төмөрбатаагийн нэрэмжит олон улсын тэмцээн үргэлжилж байна 5 өдөр,https://montsame.mn/mn/read/396252
Montsame,"СЭЛЭНГЭ: Хоёр сургуулийн нөхөрсөг харилцааны хүрээнд харилцан туршлага солилцох, зарим ажлуудаа хамтран зохион байгуулдаг уламжлал тогтжээ 5 өдөр",https://montsame.mn/mn/read/396245
Montsame,ДОРНОГОВЬ: Сайншандын олон өнгө 6 өдөр,https://montsame.mn/mn/read/396149
Montsame,ОРХОН: Олон улсын театрын уран бүтээлчид 50 мянга гаруй хүүхдэд тоглолтоо хүргэнэ 7 өдөр,https://montsame.mn/mn/read/396030
Montsame,"Ойрын өдрүүдэд ихэнх нутгаар цаг агаар тогтуун байна Улаанбаатар, 2026 оны дөрөвдүгээр сарын 21 /МОНЦАМЭ/. Энэ сарын 21-23-нд ихэнх нутгаар... 6 цаг",https://montsame.mn/mn/read/396642
Montsame,"Байгаль орчны чиглэлд хамтран ажиллах сонирхолтой байна Улаанбаатар, 2026 оны дөрөвдүгээр сарын 20 /МОНЦАМЭ/. НҮБ-ын Монгол дахь Суурин... 1 өдөр",https://montsame.mn/mn/read/396550
Montsame,"Халх голын сав газраар цас орж шуурна Улаанбаатар, 2026 оны дөрөвдүгээр сарын 20 /МОНЦАМЭ/. Зүүн... 1 өдөр",https://montsame.mn/mn/read/396512
Montsame,"Нутгийн зүүн хагаст өнөөдөр шороон болон цасан шуурга шуурна Улаанбаатар, 2026 оны дөрөвдүгээр сарын 19 /МОНЦАМЭ/. Нутгийн зүүн хагаст өнөөдөр хүчтэй... 2 өдөр",https://montsame.mn/mn/read/396483
Montsame,"Хустайн байгалийн цогцолбор газрын энэ оны анхны унага Улаанбаатар, 2026 оны дөрөвдүгээр сарын 17 /МОНЦАМЭ/. Хустайн Байгалийн цогцолбор газрын... 4 өдөр",https://montsame.mn/mn/read/396429
Montsame,"Цасан болон шороон шуурга шуурч, салхи зарим үед 34 м/сек хүрч ширүүснэ Улаанбаатар, 2026 оны дөрөвдүгээр сарын 17 /МОНЦАМЭ/. Монгол орны ихэнх нутгаар энэ сарын... 4 өдөр",https://montsame.mn/mn/read/396420
Montsame,"“Өнө мөнхийн Монгол” хөтөлбөрийн зорилт, төлөвлөгөө, хэрэгжилтийн явцыг танилцууллаа Улаанбаатар, 2026 оны дөрөвдүгээр сарын 17 /МОНЦАМЭ/. Байгаль орчин, уур амьсгалын... 4 өдөр",https://montsame.mn/mn/read/396385
Montsame,"Аймаг, нийслэл, сум, дүүргийн ИТХ-ын сонгуулийн тухай хуульд өөрчлөлт оруулах тухай хуулийн төслийг өргөн мэдүүллээ 18 минут",https://montsame.mn/mn/read/396726
Montsame,"ДОРНОГОВЬ: Уран барималч Б. Түвшинтөр олон сайн уран бүтээл хийж, өөрийн гэсэн шавьтай болохыг мөрөөддөг 4 цаг",https://montsame.mn/mn/read/396690
Montsame,Монгол Улсын Ерөнхийлөгч Төв Азийн бүх улсад айлчилсан нь гадаад бодлогоо тэлсэн чухал алхам боллоо 4 цаг,https://montsame.mn/mn/read/396672
Montsame,ХӨВСГӨЛ: Нийтийн цэнгээнт бүжгийн спортоор хичээллэдэг иргэд эрс нэмэгджээ 4 цаг,https://montsame.mn/mn/read/396678
Montsame,СЭЛЭНГЭ: Хүүхдийн хоолны нэгдсэн цэстэй болно 5 цаг,https://montsame.mn/mn/read/396665
Montsame,Монголын уулчдын өдөр тохиож байна 5 цаг,https://montsame.mn/mn/read/396667
Montsame,Төрийн албаны тухай хуульд бодлогын цогц шинэчлэл хийх санал боловсруулах чиглэл өглөө 5 цаг,https://montsame.mn/mn/read/396663
Montsame,ЖДҮХС-гийн хөнгөлөлттэй зээлийг 8 жилээр олгож эхэллээ 5 цаг,https://montsame.mn/mn/read/396666
Montsame,ДАРХАН-УУЛ: Улсын төсвийн хөрөнгө оруулалтаар 410 төсөл хөтөлбөр хэрэгжинэ 5 цаг,https://montsame.mn/mn/read/396664
Montsame,Улсын нисэхийн тухай хуулийн шинэчилсэн найруулгын төслийг өргөн мэдүүлэв 5 цаг,https://montsame.mn/mn/read/396662
Montsame,У.Ляйен сонгуульд ялсан Р.Радевт баяр хүргэжээ 5 цаг,https://montsame.mn/mn/read/396650
Montsame,БУЛГАН: Олон улсын нүүдлийн театрын наадам сумдад эхэллээ 5 цаг,https://montsame.mn/mn/read/396639
Montsame,ДОРНОГОВЬ: Зөвлөлтийн цэргийг үдсэн өдөр 5 цаг,https://montsame.mn/mn/read/396659
Montsame,СҮХБААТАР: Баруун-Урт суманд 352 камер хэвийн ажиллаж байна 5 цаг,https://montsame.mn/mn/read/396653
Montsame,Жон Тернус Apple-ийн гүйцэтгэх захирлаар ажиллана 6 цаг,https://montsame.mn/mn/read/396647
Montsame,Монгол Улсын Ерөнхийлөгч У.Хүрэлсүх Бүгд Найрамдах Казахстан Улсад хийж буй төрийн айлчлал эхэллээ 6 цаг,https://montsame.mn/mn/read/396644
Montsame,Америкийн төлөөлөгчид хэлэлцээ хийхээр Исламабадыг зорьжээ 7 цаг,https://montsame.mn/mn/read/396641
Montsame,А.Соболенко “Лауреус” шагналыг хүртлээ 7 цаг,https://montsame.mn/mn/read/396640
Montsame,"ӨНӨӨДӨР: ""Дэлхийн хүний эрхийн төлөв байдал, Монгол дахь тусгал"" хэлэлцүүлэг болно 7 цаг",https://montsame.mn/mn/read/396611
Montsame,Ерөнхийлөгч У.Хүрэлсүх Бүгд Найрамдах Казахстан Улсад төрийн айлчлал хийхээр хүрэлцэн ирлээ 15 цаг,https://montsame.mn/mn/read/396636
Montsame,Ерөнхийлөгч У.Хүрэлсүх Бүгд Найрамдах Казахстан Улсад төрийн айлчлал хийхээр хүрэлцэн очлоо 16 цаг,https://montsame.mn/mn/read/396634
Montsame,"ХХОАТ-ын 2025 оны хөнгөлөлт, буцаан олголтыг иргэдийн дансанд шилжүүлж эхэлжээ 20 цаг",https://montsame.mn/mn/read/396631
Montsame,"Олон улсын хятад хэлний өдөрт зориулж уран бичлэг, дүрслэх урлагийн үзэсгэлэнг нээв 20 цаг",https://montsame.mn/mn/read/396628
Montsame,"ХОВД: Гамшгаас хамгаалах иж бүрэн сургууль, дадлага хийнэ 20 цаг",https://montsame.mn/mn/read/396630
Montsame,Дархан-Уул аймаг 25 мянган га талбайд тариалалт хийнэ 20 цаг,https://montsame.mn/mn/read/396629
Montsame,"БАЯНХОНГОР: Аяны туг дамжсан байгууллагууд шинэ санаачилга, бүтээлч ажлууд өрнүүлж байна 21 цаг",https://montsame.mn/mn/read/396626
Montsame,УВС: Энэ жил хоёр сая орчим мод тарина 21 цаг,https://montsame.mn/mn/read/396552
Montsame,Үе тэнгийнхний дээрэлхэлтэд “Нэг мөр цэг тавья” хэлэлцүүлэг боллоо 21 цаг,https://montsame.mn/mn/read/396622
Montsame,Г.Батсуурь: Уран зохиол дахь жендэрийн судалгаа эрчимжиж байна 21 цаг,https://montsame.mn/mn/read/396424
Montsame,Эрүүл мэндийн байгууллагын “Нээлттэй хаалганы өдөрлөг” эхэллээ 21 цаг,https://montsame.mn/mn/read/396583
Montsame,Казахстаны шинэ парламентын сонгууль наймдугаар сард болно 21 цаг,https://montsame.mn/mn/read/396613
Montsame,НҮБ-ын Суурин зохицуулагч Яап ван Хиердэн Солонгосын виз мэдүүлгийн төвд зочиллоо 21 цаг,https://montsame.mn/mn/read/396619
Montsame,Ерөнхий боловсролын 12 сургуулийн 1600 гаруй сурагч бөхийн барилдааныг дэргэдээс нь үзэж сонирхжээ 21 цаг,https://montsame.mn/mn/read/396617
Montsame,ӨВӨРХАНГАЙ: Ханхөгшин хайрхныг тахина 21 цаг,https://montsame.mn/mn/read/396615
Montsame,“2026 QUIZ ON KOREA” - Монгол Улсыг төлөөлөн оролцох ялагчийг шалгаруулах тэмцээнд урьж байна 21 цаг,https://montsame.mn/mn/read/396600
Montsame,Дорнын их яруу найрагч Б.Явуухулангийн нэрэмжит “Мөнгөн хазаарын чимээ” наадам болно 21 цаг,https://montsame.mn/mn/read/396598
Montsame,ОХУ-аас Монгол улсад агаарын хөлгийн түлш хөнгөлөлттэй нөхцөлөөр тогтмол нийлүүлнэ 22 цаг,https://montsame.mn/mn/read/396603
Montsame,Японы зүүн хойд нутагт 7.5 магнитудын хүчтэй газар хөдөлжээ 22 цаг,https://montsame.mn/mn/read/396602
Montsame,"ХӨВСГӨЛ: “Мөрөнгийн хавар-2026” тэмцээнд олон аймаг, клубийн тамирчид оролцлоо 22 цаг",https://montsame.mn/mn/read/396605
Montsame,ДОРНОГОВЬ: Хамарын хийдийг зорих аялагчдын урсгал нэмэгджээ 22 цаг,https://montsame.mn/mn/read/396606
Montsame,Үйлдвэрлэл урлалын политехник коллеж 60 жилд 45 мянган төгсөгч бэлтгэжээ 5 өдөр,https://montsame.mn/mn/read/396290
Montsame,39 дэх удаагийн “Номын баяр”-ын тов гарлаа 5 өдөр,https://montsame.mn/mn/read/396213
Montsame,ӨНӨӨДӨР: “Монгол судлалын шинэ эрин-VI” олон улсын эрдэм шинжилгээний хурал болно 5 өдөр,https://montsame.mn/mn/read/396141
Montsame,Б.Энхмаа: Төрийн мэдээллийн санд суурилан тооллогыг анх удаа цахимаар зохион байгуулж байна 4 өдөр,https://montsame.mn/mn/read/396405
Montsame,Монголын Скаутын Холбооны 35 жилийн ой тохиож байна 3 өдөр,https://montsame.mn/mn/read/396475
