source,title,url
Montsame,"Орчин цагийн англи хэлний утга зохиолын үгсийн сан У.Шекспирээс, Оросынх А.С.Пушкинээс эхтэй бол Монголынх гарцаагүй Д.Нацагдорж 4 өдөр",https://montsame.mn/mn/read/396117
Montsame,СҮХБААТАР: Цаг агаарын гамшигт үзэгдлээс онцгойлон анхаарууллаа 4 өдөр,https://montsame.mn/mn/read/396441
Montsame,Ираны эсрэг ажиллагааг зогсоох тухай тогтоолыг Сенат баталсангүй 5 өдөр,https://montsame.mn/mn/read/396233
Montsame,АНУ-ын ЭСЯ: Визийн бондын шаардлага нь ухарч үйлчлэхгүй,https://montsame.mn/mn/read/396292
Montsame,"Соёлын элч, уран бүтээлч Ц.Ган-Эрдэнэ ""Мөнх тэнгэрт"" үзэсгэлэнгээ дэлгэнэ",https://montsame.mn/mn/read/395704
Montsame,Гуравдагч хөршөөс чанагш: Их гүрнүүдийн өрсөлдөөн дундах Монгол-Америкийн харилцаа,https://montsame.mn/mn/read/392105
Montsame,"Байгаль хамгаалал, бэлчээрийн бодлогыг тогтвортой санхүүжилттэй уялдуулах хамтын ажиллагааг эхлүүллээ",https://montsame.mn/mn/read/394411
Montsame,Тусгай хамгаалалттай газар нутгийн замын зургийг боловсруулж эхэллээ,https://montsame.mn/mn/read/394262
Montsame,"Б.Цэцэнцолмон: Ардчиллаар үндэсний ухамсар, оюун санаа сэргэх суурийг өвөө маань уран бүтээлээрээ бэлдэж өгсөн",https://montsame.mn/mn/read/394861
Montsame,"ӨМНӨГОВЬ: ""Шим билэг"", ""Энхийн хүслэн"" өрхийн эрүүл мэндийн төвүүд авто машинтай болов",https://montsame.mn/mn/read/396572
Montsame,Төлийн дуу цангинасан урин хавар,https://montsame.mn/mn/read/396391
Montsame,Түншлэлийг хөгжүүлэх 50 гаруй төслийг танилцуулж байна,https://montsame.mn/mn/read/396593
Montsame,“Hugo and color” улсын XVII олимпиадын шилдгүүд тодорлоо,https://montsame.mn/mn/read/396480
Montsame,Монголын нутгаас кроманьон хүний шүд олджээ,https://montsame.mn/mn/read/396580
Montsame,Тероподуудын чулуужсан мөрүүдийг Монголоос олжээ,https://montsame.mn/mn/read/396277
Montsame,Дауны синдромтой хүмүүсийн хромосомыг идэвхгүй болгох аргыг нээжээ,https://montsame.mn/mn/read/395961
Montsame,СҮХБААТАР: Хосгүй үнэт үзмэр буюу үзэмчин эмэгтэйн хувцас,https://montsame.mn/mn/read/396433
Montsame,СЭЛЭНГЭ: Түүхийг дижиталаар амилуулсан шилдэг бүтээл,https://montsame.mn/mn/read/394743
Montsame,СЭЛЭНГЭ: Аймгийн Нэгдсэн Музей шинэ танхим нэмлээ,https://montsame.mn/mn/read/394558
Montsame,СУРТАЛЧИЛГАА БАЙРШУУЛАХ,https://montsame.mn/mn/read/335755
Montsame,“Эсгийн гайхамшиг-Шинэ дуу хоолой” эсгий урлалын өнөөгийн өнгө төрх,https://montsame.mn/mn/read/396691
Montsame,Монгол Улсын хэмжээнд тарьц суулгацын нөөц 163 саяд хүрчээ,https://montsame.mn/mn/read/396697
Montsame,Ц.Магсар: Цаг хугацаа өнгөрөх тусам Д.Нацагдорж тодорно хэмээн үнэлсэн байдаг,https://montsame.mn/mn/read/396554
Montsame,"Хеликобактерийн халдвараас урьдчилан сэргийлэх, үе тэнгийн дээрэлхэлтийн эсрэг төслийг хамтран хэрэгжүүлнэ Улаанбаатар /МОНЦАМЭ/. НЗДТГ НҮБ-ын Хүүхдийн сантай хамтран хеликобактерийн халдвараас... 11 минут",https://montsame.mn/mn/read/396744
Montsame,"Хаягдал ясаар органик бордоо, тэжээл, онгоцны дизель түлшний түүхий эд үйлдвэрлэж байна Улаанбаатар, 2062 оны дөрөвдүгээр сарын 21 /МОНЦАМЭ/. Манай улс жилд 15 мянган тонн... 36 минут",https://montsame.mn/mn/read/396740
Montsame,"Монголчуудын үсэг бичиг, утга соёлын товчоон номын гутгаар хэвлэл уншигчдын хүртээл боллоо Улаанбаатар, 2026 оны дөрөвдүгээр сарын 21 /МОНЦАМЭ/. Төрийн шагналт, шинжлэх ухааны... 1 цаг",https://montsame.mn/mn/read/396735
Montsame,"Н.Учрал: Засгийн газар цахимд тулгуурласан эдийн засгийг хөгжүүлнэ Улаанбаатар, 2026 оны дөрөвдүгээр сарын 21 /МОНЦАМЭ/. Мэдээллийн технологийн үйлдвэрлэл,... 2 цаг",https://montsame.mn/mn/read/396728
Montsame,"ИТХ-ын сонгуулийн тухай хуульд өөрчлөлт оруулах тухай хуулийн төслийг өргөн мэдүүлэв Улаанбаатар, 2026 оны дөрөвдүгээр сарын 21 /МОНЦАМЭ/. УИХ-ын дарга С.Бямбацогтод... 3 цаг",https://montsame.mn/mn/read/396716
Montsame,"НҮБ-ын конвенцын Талуудын 17 дугаар бага хурлын албан ёсны цахим хуудсыг нээв Улаанбаатар, 2026 оны дөрөвдүгээр сарын 21 /МОНЦАМЭ/. Монгол Улсад зохион байгуулах... 5 цаг",https://montsame.mn/mn/read/396699
Montsame,"“Дүнжингарав-2026” хаврын морин уралдааны тов гарлаа Улаанбаатар, 2026 оны дөрөвдүгээр сарын 21 /МОНЦАМЭ/. Монголын Морин Спорт, Уяачдын... 5 цаг",https://montsame.mn/mn/read/396689
Montsame,"Ираны тал АНУ-тай хэлэлцээ хийхийг зөвшөөрчээ ВАШИНГТОН, 2026 оны дөрөвдүгээр сарын 21 /Axios/. Ираны Дээд удирдагч Аятолла Можтаба... 11 минут",https://montsame.mn/mn/read/396742
Montsame,"Кубын эдийн засгийг шинэчлэх асуудлыг хэлэлцжээ НЬЮ-ЙОРК, 2026 оны дөрөвдүгээр сарын 21 /TASS/. АНУ-ын төлөөлөгчид Кубын талтай хийсэн... 25 минут",https://montsame.mn/mn/read/396722
Montsame,"Мексикт жуулчид руу гал нээжээ МЕХИКО, 2026 оны дөрөвдүгээр сарын 21 /Kazinform/. Мехико хотоос холгүй орших жуулчдын... 27 минут",https://montsame.mn/mn/read/396734
Montsame,"Вембаньяма шилдэг хамгаалан тоглогчоор шалгарлаа ВАШИНГТОН, 2026 оны дөрөвдүгээр сарын 21. /ТАСС/. “Сан-Антонио Спэрс” багийн төвийн... 31 минут",https://montsame.mn/mn/read/396739
Montsame,"Сербид олгох 1.5 тэрбумын санхүүжилтийг зогсооно гэж анхааруулав БРЮССЕЛЬ, 2026 оны дөрөвдүгээр сарын 21 /DW/. Хэрвээ ардчиллын эсрэг чиг хандлагаа... 3 цаг",https://montsame.mn/mn/read/396717
Montsame,"Японы зэвсгийн экспортод тавьсан хязгаарлалтыг цуцалжээ ТОКИО, 2026 оны дөрөвдүгээр сарын 21 /TASS/. Японы Засгийн газар “батлан хамгаалахын... 3 цаг",https://montsame.mn/mn/read/396701
Montsame,"Филиппин-Америкийн хамтарсан сургуулилалтад Япон улс анх удаа оролцож байна МАНИЛА, 2026 оны дөрөвдүгээр сарын 21 /Kyodo/. Филиппин, АНУ-ын Зэвсэгт хүчний жил тутмын... 5 цаг",https://montsame.mn/mn/read/396688
Montsame,"Шинэ чиглэлийг эрэлхийлэх нь: Казахстан Улс Монголын стратегийн чухал чиглэл болж байна БАКУ, 2026 оны дөрөвдүгээр сарын 21 /Trend/. Бүгд Найрамдах Казахстан Улсын Ерөнхийлөгч... 5 цаг",https://montsame.mn/mn/read/396673
Montsame,"""Бавариа"" баг дөрвөн тоглолтын өмнө Германы аварга боллоо БЕРЛИН, 2026 оны дөрөвдүгээр сарын 21 /ТАСС/. “Бавариа” баг ням гарагт “Штутгарт”-ыг 4:2... 6 цаг",https://montsame.mn/mn/read/396682
Montsame,"ОРХОН: Жаргалант суманд бүрэн автомат өндөглөгч тахианы ферм үйл ажиллагаагаа эхлүүллээ Баян-Өндөр,2026 оны дөрөвдүгээр сарын 21/МОНЦАМЭ/. Орхон аймгийн Жаргалант сумын 2... 5 минут",https://montsame.mn/mn/read/396733
Montsame,ЗАВХАН: Хөрсний доройтлын ихэнх нь мал аж ахуйн салбартай холбоотой байна Улиастай. 2026 оны дөрөвдүгээр сарын 21. /МОНЦАМЭ/. Завхан аймгийн 24 сумын хөрсний... 13 минут,https://montsame.mn/mn/read/396719
Montsame,"АРХАНГАЙ: Зая гэгээний хийдийн цогцолбор Эрдэнэбулган, 2026 оны дөрөвдүгээр сарын 21 /МОНЦАМЭ/. Архангай аймгийн Эрдэнэбулган... 24 минут",https://montsame.mn/mn/read/396737
Montsame,СҮХБААТАР: Орон нутагт гадаад харилцааг дээшлүүлэх чиглэлээр санал солилцов Баруун-Урт 2026 оны дөрөвдүгээр сарын 21 /МОНЦАМЭ/. Гадаад харилцааны яамны Төрийн нарийн... 28 минут,https://montsame.mn/mn/read/396741
Montsame,"Дорнод аймаг энэ хавар 26,4 мянган га-д тариалалт хийнэ 40 минут",https://montsame.mn/mn/read/396738
Montsame,"Э.Одмаа: Хобби, сонирхлоо хөгжүүлэх нь гэр бүлийн харилцаа, тогтвортой байдалд эерэг нөлөөтэй Зуунмод, 2026 оны дөрөвдүгээр сарын 21 /МОНЦАМЭ/. Олон улсын Гэр бүлийн өдрийг угтан “Бүх... 1 цаг",https://montsame.mn/mn/read/396627
Montsame,"УВС: Аймгийн хэмжээнд 37 төрлийн мод, бут, сөөгийн тарьц, суулгац үржүүлж байна Улаангом, 2026 оны дөрөвдүгээр сарын 21 /МОНЦАМЭ/. Хаврын мод тарих ажил эхэлсэнтэй... 1 цаг",https://montsame.mn/mn/read/396720
Montsame,Өвөрхангай аймагт орчин үеийн жишиг эмнэлгүүд ашиглалтад оржээ 2 цаг,https://montsame.mn/mn/read/396727
Montsame,"ЗАВХАН: Монгол бичиг, уран бичлэгийн уралдаануудад Сантмаргаз сумын хүүхдүүд хошуучлав Улиастай. 2026 оны дөрөвдүгээр сарын 21. /МОНЦАМЭ/. Үндэсний бичиг үсгийн баярын хүрээнд... 3 цаг",https://montsame.mn/mn/read/396718
Montsame,"Монголын үнэт цаасны зах зээлийн нийт гүйлгээ 2026 оны эхний улиралд 269.5 тэрбум төгрөгт хүрчээ Улаанбаатар, 2026 оны дөрөвдүгээр сарын 20 /МОНЦАМЭ/. 2026 оны эхний улирлын байдлаар... 1 өдөр",https://montsame.mn/mn/read/396556
Montsame,"Ормузийн хоолой дэлхийн зах зээлийн анхаарлын төвд дахин орж ирэв Улаанбаатар, 2026 оны дөрөвдүгээр сарын 20 /МОНЦАМЭ/. Өнгөрсөн долоо хоногт Ойрх Дорнодын... 1 өдөр",https://montsame.mn/mn/read/396560
Montsame,"ТОП-50-д багтсан Казахстаны тухай сонирхолтой баримтууд УЛААНБААТАР, 2026 оны дөрөвдүгээр сарын 20 /МОНЦАМЭ/. Энэ өдрүүдэд Монгол Улсын... 1 өдөр",https://montsame.mn/mn/read/396438
Montsame,"АРВАНЗУРГАА ДАХЬ ДОЛОО ХОНОГ: АНУ, Ираны төлөөлөгчид хэлэлцээ хийлээ УЛААНБААТАР, 2026 оны дөрөвдүгээр сарын 18 /МОНЦАМЭ/. Ойрх Дорнодод сар гаруйн өмнө... 3 өдөр",https://montsame.mn/mn/read/396416
Montsame,"Орбан ялагдсан ч “орбанизм” ялагдаагүй БУДАПЕШТ, 2026 оны дөрөвдүгээр сарын 17 /ВВС/. Сүүлийн 16 жилийн хугацаанд Виктор Орбан... 4 өдөр",https://montsame.mn/mn/read/396410
Montsame,"Хөрөнгө оруулалт бонд, технологи, хиймэл оюунтай холбоотой хувьцаанууд руу дахин чиглэжээ Улаанбаатар, 2026 оны дөрөвдүгээр сарын 13 /МОНЦАМЭ/. Ойрх Дорнод дахь зэвсэгт мөргөлдөөн... 8 өдөр",https://montsame.mn/mn/read/395885
Montsame,"Монгол Улсад эрдэс баялгийн салбар эдийн засгийн гол тулгуур хэвээр байна Улаанбаатар, 2026 оны дөрөвдүгээр сарын 13 /МОНЦАМЭ/. Монгол Улсын хувьд эрдэс баялгийн... 8 өдөр",https://montsame.mn/mn/read/395877
Montsame,"Түүхэн нислэгийн тэгш ойд зориулсан сонирхолтой баримтууд УЛААНБААТАР, 2026 оны дөрөвдүгээр сарын 12 /МОНЦАМЭ/. Одоогоос яг 65 жилийн өмнө ЗХУ-ын... 9 өдөр",https://montsame.mn/mn/read/395790
Montsame,"АРВАНТАВ ДАХЬ ДОЛОО ХОНОГ: Ойрх Дорнодын дайн түр зогслоо УЛААНБААТАР, 2026 оны дөрөвдүгээр сарын 11 /МОНЦАМЭ/. Өнгөрч буй долоо хоног хүн... 10 өдөр",https://montsame.mn/mn/read/395785
Montsame,"Сургуулиа төгсөөд дээд сургуульд ороогүйдээ нэг их харамсдаггүй Баруун-Урт, 2026 оны дөрөвдүгээр сарын 21 /МОНЦАМЭ/. Намайг С.Мөнх-Эрдэнэ гэдэг. Хувиараа... 7 цаг",https://montsame.mn/mn/read/389712
Montsame,"61 настай оюун ухааны тамирчин Улаанбаатар, 2026 оны дөрөвдүгээр сарын 21 /МОНЦАМЭ/. Намайг Даваа овогтой Гандолгор... 8 цаг",https://montsame.mn/mn/read/396142
Montsame,"Боксын хүч, иогийн зөөлөн хэмнэл зүрх сэтгэлийг минь тэнцвэртэй болгодог Улаанбаатар, 2026 оны дөрөвдүгээр сарын 17 /МОНЦАМЭ/. Гурван ахтай, айлын ганц охин... 4 өдөр",https://montsame.mn/mn/read/390208
Montsame,"Хилийн чанадад сурч, эх орондоо ирэх сонголтыг хийсэн маань оносон Улаанбаатар, 2026 оны дөрөвдүгээр сарын 17 /МОНЦАМЭ/. Намайг Хүрэлчулуун овогтой... 4 өдөр",https://montsame.mn/mn/read/396001
Montsame,"Хэрэв би ном уншдаггүй байсан бол ийм итгэлтэй байж чадахгүй Эрдэнэбулган, 2026 оны дөрөвдүгээр сарын 14 /МОНЦАМЭ/. Зарим хүүхэд багаасаа л номтой... 7 өдөр",https://montsame.mn/mn/read/394963
Montsame,"Гагнуураар амьдралаа бүтээж, зургаар мөрөөдлөө биелүүлнэ Улаанбаатар, 2026 оны дөрөвдүгээр сарын 14 /МОНЦАМЭ/. Намайг Эрдэнэ овогтой Уужимсэтгэлт... 7 өдөр",https://montsame.mn/mn/read/395750
Montsame,"Морин дээрээс 7 секундэд 10 сум харвах мэдрэмж Улаанбаатар, 2026 оны дөрөвдүгээр сарын 10 /МОНЦАМЭ/. Монголын морьт харваачид хамгийн... 11 өдөр",https://montsame.mn/mn/read/390550
Montsame,"160 тонн хүдэр тээвэрлэгчийн жолооч монгол охин Улаанбаатар, 2026 оны дөрөвдүгээр сарын 10 /МОНЦАМЭ/. Намайг Ганбаатар овогтой Сугарсүрэн... 11 өдөр",https://montsame.mn/mn/read/395657
Montsame,"Номын амт ба ном уншдаг, уншдаггүй хүний ялгаа Эрдэнэбулган, 2026 оны дөрөвдүгээр сарын 7 /МОНЦАМЭ/. Би энэ хичээлийн жил эхэлснээс хойш... 14 өдөр",https://montsame.mn/mn/read/394941
Montsame,ОРХОН: Масс олимпиадад 3 дугаар ангийн сурагчдыг анх удаа хамрууллаа 3 өдөр,https://montsame.mn/mn/read/396467
Montsame,ОРХОН: “Аврагч-2026” тэмцээнийг 27 дахь жилдээ зохион байгуулж байна 4 өдөр,https://montsame.mn/mn/read/396382
Montsame,ДАРХАН-УУЛ: Морин хуурын дугуйлангуудад дэмжлэг үзүүллээ 4 өдөр,https://montsame.mn/mn/read/396308
Montsame,ДОРНОГОВЬ: Хар загийн байгалийн үзэсгэлэнт газар 5 өдөр,https://montsame.mn/mn/read/396298
Montsame,СЭЛЭНГЭ: Багачууд инженерийн мэдлэгээ сорилоо 5 өдөр,https://montsame.mn/mn/read/396266
Montsame,ДОРНОД: Гавьяат дасгалжуулагч Ё.Төмөрбатаагийн нэрэмжит олон улсын тэмцээн үргэлжилж байна 5 өдөр,https://montsame.mn/mn/read/396252
Montsame,"СЭЛЭНГЭ: Хоёр сургуулийн нөхөрсөг харилцааны хүрээнд харилцан туршлага солилцох, зарим ажлуудаа хамтран зохион байгуулдаг уламжлал тогтжээ 5 өдөр",https://montsame.mn/mn/read/396245
Montsame,"Ойрын өдрүүдэд ихэнх нутгаар цаг агаар тогтуун байна Улаанбаатар, 2026 оны дөрөвдүгээр сарын 21 /МОНЦАМЭ/. Энэ сарын 21-23-нд ихэнх нутгаар... 8 цаг",https://montsame.mn/mn/read/396642
Montsame,"Байгаль орчны чиглэлд хамтран ажиллах сонирхолтой байна Улаанбаатар, 2026 оны дөрөвдүгээр сарын 20 /МОНЦАМЭ/. НҮБ-ын Монгол дахь Суурин... 1 өдөр",https://montsame.mn/mn/read/396550
Montsame,"Халх голын сав газраар цас орж шуурна Улаанбаатар, 2026 оны дөрөвдүгээр сарын 20 /МОНЦАМЭ/. Зүүн... 1 өдөр",https://montsame.mn/mn/read/396512
Montsame,"Нутгийн зүүн хагаст өнөөдөр шороон болон цасан шуурга шуурна Улаанбаатар, 2026 оны дөрөвдүгээр сарын 19 /МОНЦАМЭ/. Нутгийн зүүн хагаст өнөөдөр хүчтэй... 2 өдөр",https://montsame.mn/mn/read/396483
Montsame,"Хустайн байгалийн цогцолбор газрын энэ оны анхны унага Улаанбаатар, 2026 оны дөрөвдүгээр сарын 17 /МОНЦАМЭ/. Хустайн Байгалийн цогцолбор газрын... 4 өдөр",https://montsame.mn/mn/read/396429
Montsame,"Цасан болон шороон шуурга шуурч, салхи зарим үед 34 м/сек хүрч ширүүснэ Улаанбаатар, 2026 оны дөрөвдүгээр сарын 17 /МОНЦАМЭ/. Монгол орны ихэнх нутгаар энэ сарын... 4 өдөр",https://montsame.mn/mn/read/396420
Montsame,"“Өнө мөнхийн Монгол” хөтөлбөрийн зорилт, төлөвлөгөө, хэрэгжилтийн явцыг танилцууллаа Улаанбаатар, 2026 оны дөрөвдүгээр сарын 17 /МОНЦАМЭ/. Байгаль орчин, уур амьсгалын... 4 өдөр",https://montsame.mn/mn/read/396385
Montsame,"Канад улстай хамтарсан “Тэгш эрх, шударга ёсыг хүн бүрд” төсөл амжилттай хэрэгжиж байна 1 цаг",https://montsame.mn/mn/read/396730
Montsame,"Аймаг, нийслэл, сум, дүүргийн ИТХ-ын сонгуулийн тухай хуульд өөрчлөлт оруулах тухай хуулийн төслийг өргөн мэдүүллээ 2 цаг",https://montsame.mn/mn/read/396726
Montsame,ХОВД: Нутгийн 50 орчим хувьд бэлчээрийн ургамал цухуйжээ 3 цаг,https://montsame.mn/mn/read/396715
Montsame,ЗАВХАН: Хөгжлийн бэрхшээлтэй иргэдийн хөгжлийн төвийн барилгын ажил эхэллээ 3 цаг,https://montsame.mn/mn/read/396714
Montsame,Төвийн бүсийн “Чадварлаг сувилагч” тэмцээнд Орхон аймгийн сувилагчид тэргүүллээ 4 цаг,https://montsame.mn/mn/read/396569
Montsame,БАЯНХОНГОР: Усан хөтлийн уяад 200 бог багтдаг 4 цаг,https://montsame.mn/mn/read/396702
Montsame,Өвөрхангай аймгийг авто замын сүлжээнд холбоно 4 цаг,https://montsame.mn/mn/read/396704
Montsame,СЭЛЭНГЭ: Гадаадын хөрөнгө оруулалтыг нэмэгдүүлэх алхмууд хийж байна 4 цаг,https://montsame.mn/mn/read/396698
Montsame,"ӨМНӨГОВЬ: Орон нутгийн төсвийн 23 хувийг боловсрол, авто замын салбарт 16 хувийг зарцуулж байна 5 цаг",https://montsame.mn/mn/read/396694
Montsame,"ДОРНОГОВЬ: Уран барималч Б. Түвшинтөр олон сайн уран бүтээл хийж, өөрийн гэсэн шавьтай болохыг мөрөөддөг 5 цаг",https://montsame.mn/mn/read/396690
Montsame,Үлэг гүрвэлийн олдворуудыг эх оронд нь эргүүлэн авчрах ажлын хэсэг Парис хотноо ажиллав 6 цаг,https://montsame.mn/mn/read/396683
Montsame,Монгол Улсын Ерөнхийлөгч Төв Азийн бүх улсад айлчилсан нь гадаад бодлогоо тэлсэн чухал алхам боллоо 6 цаг,https://montsame.mn/mn/read/396672
Montsame,ХӨВСГӨЛ: Нийтийн цэнгээнт бүжгийн спортоор хичээллэдэг иргэд эрс нэмэгджээ 6 цаг,https://montsame.mn/mn/read/396678
Montsame,"“Мастер, Маргарита хоёр” романаас сэдэвлэсэн жүжгийн найруулагчаар Э.Билгүүн ажиллана 6 цаг",https://montsame.mn/mn/read/396671
Montsame,Гавьяат тамирчин Б.Сэр-Од Бостоны марафонд 54 дүгээрт бариалжээ 6 цаг,https://montsame.mn/mn/read/396674
Montsame,Энэтхэг-Өмнөд Солонгосын худалдааг 50 тэрбум ам.долларт хүргэнэ 6 цаг,https://montsame.mn/mn/read/396661
Montsame,Т.Санаэ Ясүкүни сүмд өргөл барьц илгээжээ 6 цаг,https://montsame.mn/mn/read/396645
Montsame,СЭЛЭНГЭ: Хүүхдийн хоолны нэгдсэн цэстэй болно 6 цаг,https://montsame.mn/mn/read/396665
Montsame,Монголын уулчдын өдөр тохиож байна 6 цаг,https://montsame.mn/mn/read/396667
Montsame,Төрийн албаны тухай хуульд бодлогын цогц шинэчлэл хийх санал боловсруулах чиглэл өглөө 6 цаг,https://montsame.mn/mn/read/396663
Montsame,ЖДҮХС-гийн хөнгөлөлттэй зээлийг 8 жилээр олгож эхэллээ 6 цаг,https://montsame.mn/mn/read/396666
Montsame,Д.Трамп: Израил улс намайг Ирантай дайтахыг ятгаагүй 6 цаг,https://montsame.mn/mn/read/396656
Montsame,ДАРХАН-УУЛ: Улсын төсвийн хөрөнгө оруулалтаар 410 төсөл хөтөлбөр хэрэгжинэ 6 цаг,https://montsame.mn/mn/read/396664
Montsame,АНУ-тай хэлэлцээ хийхгүй гэж мэдэгджээ 7 цаг,https://montsame.mn/mn/read/396658
Montsame,Улсын нисэхийн тухай хуулийн шинэчилсэн найруулгын төслийг өргөн мэдүүлэв 7 цаг,https://montsame.mn/mn/read/396662
