source,title,url
Montsame,У.Ляйен сонгуульд ялсан Р.Радевт баяр хүргэжээ 7 цаг,https://montsame.mn/mn/read/396650
Montsame,БУЛГАН: Олон улсын нүүдлийн театрын наадам сумдад эхэллээ 7 цаг,https://montsame.mn/mn/read/396639
Montsame,ДОРНОГОВЬ: Зөвлөлтийн цэргийг үдсэн өдөр 7 цаг,https://montsame.mn/mn/read/396659
Montsame,СҮХБААТАР: Баруун-Урт суманд 352 камер хэвийн ажиллаж байна 7 цаг,https://montsame.mn/mn/read/396653
Montsame,Жон Тернус Apple-ийн гүйцэтгэх захирлаар ажиллана 7 цаг,https://montsame.mn/mn/read/396647
Montsame,Монгол Улсын Ерөнхийлөгч У.Хүрэлсүх Бүгд Найрамдах Казахстан Улсад хийж буй төрийн айлчлал эхэллээ 7 цаг,https://montsame.mn/mn/read/396644
Montsame,Америкийн төлөөлөгчид хэлэлцээ хийхээр Исламабадыг зорьжээ 8 цаг,https://montsame.mn/mn/read/396641
Montsame,А.Соболенко “Лауреус” шагналыг хүртлээ 9 цаг,https://montsame.mn/mn/read/396640
Montsame,"ӨНӨӨДӨР: ""Дэлхийн хүний эрхийн төлөв байдал, Монгол дахь тусгал"" хэлэлцүүлэг болно 9 цаг",https://montsame.mn/mn/read/396611
Montsame,Ерөнхийлөгч У.Хүрэлсүх Бүгд Найрамдах Казахстан Улсад төрийн айлчлал хийхээр хүрэлцэн ирлээ 17 цаг,https://montsame.mn/mn/read/396636
Montsame,Ерөнхийлөгч У.Хүрэлсүх Бүгд Найрамдах Казахстан Улсад төрийн айлчлал хийхээр хүрэлцэн очлоо 18 цаг,https://montsame.mn/mn/read/396634
Montsame,"ХХОАТ-ын 2025 оны хөнгөлөлт, буцаан олголтыг иргэдийн дансанд шилжүүлж эхэлжээ 21 цаг",https://montsame.mn/mn/read/396631
Montsame,"Олон улсын хятад хэлний өдөрт зориулж уран бичлэг, дүрслэх урлагийн үзэсгэлэнг нээв 21 цаг",https://montsame.mn/mn/read/396628
Montsame,"ХОВД: Гамшгаас хамгаалах иж бүрэн сургууль, дадлага хийнэ 22 цаг",https://montsame.mn/mn/read/396630
Montsame,Үйлдвэрлэл урлалын политехник коллеж 60 жилд 45 мянган төгсөгч бэлтгэжээ 5 өдөр,https://montsame.mn/mn/read/396290
Montsame,39 дэх удаагийн “Номын баяр”-ын тов гарлаа 5 өдөр,https://montsame.mn/mn/read/396213
Montsame,ӨНӨӨДӨР: “Монгол судлалын шинэ эрин-VI” олон улсын эрдэм шинжилгээний хурал болно 5 өдөр,https://montsame.mn/mn/read/396141
Montsame,Б.Энхмаа: Төрийн мэдээллийн санд суурилан тооллогыг анх удаа цахимаар зохион байгуулж байна 4 өдөр,https://montsame.mn/mn/read/396405
Montsame,Монголын Скаутын Холбооны 35 жилийн ой тохиож байна 3 өдөр,https://montsame.mn/mn/read/396475
Montsame,"Орчин цагийн англи хэлний утга зохиолын үгсийн сан У.Шекспирээс, Оросынх А.С.Пушкинээс эхтэй бол Монголынх гарцаагүй Д.Нацагдорж 4 өдөр",https://montsame.mn/mn/read/396117
Montsame,Ираны эсрэг ажиллагааг зогсоох тухай тогтоолыг Сенат баталсангүй 5 өдөр,https://montsame.mn/mn/read/396233
Montsame,СҮХБААТАР: Цаг агаарын гамшигт үзэгдлээс онцгойлон анхаарууллаа 4 өдөр,https://montsame.mn/mn/read/396441
Montsame,АНУ-ын ЭСЯ: Визийн бондын шаардлага нь ухарч үйлчлэхгүй,https://montsame.mn/mn/read/396292
Montsame,"Соёлын элч, уран бүтээлч Ц.Ган-Эрдэнэ ""Мөнх тэнгэрт"" үзэсгэлэнгээ дэлгэнэ",https://montsame.mn/mn/read/395704
Montsame,Гуравдагч хөршөөс чанагш: Их гүрнүүдийн өрсөлдөөн дундах Монгол-Америкийн харилцаа,https://montsame.mn/mn/read/392105
Montsame,"Байгаль хамгаалал, бэлчээрийн бодлогыг тогтвортой санхүүжилттэй уялдуулах хамтын ажиллагааг эхлүүллээ",https://montsame.mn/mn/read/394411
Montsame,Тусгай хамгаалалттай газар нутгийн замын зургийг боловсруулж эхэллээ,https://montsame.mn/mn/read/394262
Montsame,"Б.Цэцэнцолмон: Ардчиллаар үндэсний ухамсар, оюун санаа сэргэх суурийг өвөө маань уран бүтээлээрээ бэлдэж өгсөн",https://montsame.mn/mn/read/394861
Montsame,"ӨМНӨГОВЬ: ""Шим билэг"", ""Энхийн хүслэн"" өрхийн эрүүл мэндийн төвүүд авто машинтай болов",https://montsame.mn/mn/read/396572
Montsame,Төлийн дуу цангинасан урин хавар,https://montsame.mn/mn/read/396391
Montsame,Түншлэлийг хөгжүүлэх 50 гаруй төслийг танилцуулж байна,https://montsame.mn/mn/read/396593
Montsame,Г.Батсуурь: Уран зохиол дахь жендэрийн судалгаа эрчимжиж байна,https://montsame.mn/mn/read/396424
Montsame,“Hugo and color” улсын XVII олимпиадын шилдгүүд тодорлоо,https://montsame.mn/mn/read/396480
Montsame,Монголын нутгаас кроманьон хүний шүд олджээ,https://montsame.mn/mn/read/396580
Montsame,Тероподуудын чулуужсан мөрүүдийг Монголоос олжээ,https://montsame.mn/mn/read/396277
Montsame,Дауны синдромтой хүмүүсийн хромосомыг идэвхгүй болгох аргыг нээжээ,https://montsame.mn/mn/read/395961
Montsame,СҮХБААТАР: Хосгүй үнэт үзмэр буюу үзэмчин эмэгтэйн хувцас,https://montsame.mn/mn/read/396433
Montsame,СЭЛЭНГЭ: Түүхийг дижиталаар амилуулсан шилдэг бүтээл,https://montsame.mn/mn/read/394743
Montsame,СЭЛЭНГЭ: Аймгийн Нэгдсэн Музей шинэ танхим нэмлээ,https://montsame.mn/mn/read/394558
Montsame,СУРТАЛЧИЛГАА БАЙРШУУЛАХ,https://montsame.mn/mn/read/335755
